{
  "$schema": "https://json-schema.org/draft/2020-12/schema",
  "$id": "https://solid-checker.dev/schema/typefacts-v1.schema.json",
  "title": "TypeFactsSchema v1",
  "type": "object",
  "additionalProperties": false,
  "required": ["schema", "projectId", "generation", "round", "table"],
  "properties": {
    "schema": { "const": 1 },
    "projectId": { "type": "string", "minLength": 1 },
    "generation": { "type": "integer", "minimum": 1 },
    "round": { "type": "integer", "minimum": 1, "maximum": 2 },
    "table": {
      "type": "object",
      "additionalProperties": false,
      "required": ["schema", "projectId", "generation", "sources", "entities", "symbols", "files"],
      "properties": {
        "schema": { "const": 1 },
        "projectId": { "type": "string", "minLength": 1 },
        "generation": { "type": "integer", "minimum": 1 },
        "sources": { "type": "array", "maxItems": 1000000 },
        "entities": { "type": "array", "maxItems": 1000000 },
        "symbols": { "type": "array", "maxItems": 1000000 },
        "files": { "type": "array", "maxItems": 1000000 }
      }
    }
  },
  "x-wire": {
    "encoding": "RFC 8949 deterministic CBOR",
    "framing": "uint32 little-endian byte length followed by one CBOR item",
    "optionalFields": "omitted, never null",
    "duplicateFields": "error",
    "unknownFields": "error",
    "limits": "typefacts-codec-limits.json"
  }
}
